{
  "$schema": "./api-surface.schema.json",
  "contractVersion": 1,
  "policy": "Every API is backward compatible within its published major version. Breaking changes require a new versioned route while the previous route remains available.",
  "routes": [
    { "method": "GET", "path": "/api/live", "implementation": "worker", "transport": "websocket", "version": "unversioned", "test": "tests/live-stats.test.ts" },
    { "method": "GET", "path": "/api/v1/health", "implementation": "hono", "transport": "http", "version": "v1", "test": "tests/app.test.ts" },
    { "method": "GET", "path": "/api/v1/plugins", "implementation": "hono", "transport": "http", "version": "v1", "schema": "schemas/v1/plugins.response.schema.json", "test": "tests/api-contract.test.ts" },
    { "method": "GET", "path": "/api/v1/plugins/search", "implementation": "hono", "transport": "http", "version": "v1", "schema": "schemas/v1/plugin-search.response.schema.json", "test": "tests/api-contract.test.ts" },
    { "method": "GET", "path": "/api/v1/plugins/:owner/*", "implementation": "hono", "transport": "http", "version": "v1", "test": "tests/app.test.ts" },
    { "method": "GET", "path": "/api/v1/self/install-stats", "implementation": "hono", "transport": "http", "version": "v1", "test": "tests/app.test.ts" },
    { "method": "GET", "path": "/api/v1/self/update", "implementation": "hono", "transport": "http", "version": "v1", "test": "tests/app.test.ts" },
    { "method": "GET", "path": "/api/v1/registry", "implementation": "hono", "transport": "http", "version": "v1", "schema": "schemas/v1/registry.response.schema.json", "test": "tests/api-contract.test.ts" },
    { "method": "POST", "path": "/api/v1/catalog/sync", "implementation": "hono", "transport": "http", "version": "v1", "test": "tests/app.test.ts" },
    { "method": "POST", "path": "/api/v1/install-events", "implementation": "hono", "transport": "http", "version": "v1", "test": "tests/app.test.ts" },
    { "method": "GET", "path": "/api/v1/auth/github/login", "implementation": "hono", "transport": "http", "version": "v1", "test": "tests/auth-api.test.ts" },
    { "method": "GET", "path": "/api/v1/auth/github/callback", "implementation": "hono", "transport": "http", "version": "v1", "test": "tests/auth-api.test.ts" },
    { "method": "GET", "path": "/api/v1/auth/me", "implementation": "hono", "transport": "http", "version": "v1", "test": "tests/auth-api.test.ts" },
    { "method": "POST", "path": "/api/v1/auth/logout", "implementation": "hono", "transport": "http", "version": "v1", "test": "tests/auth-api.test.ts" },
    { "method": "GET", "path": "/api/v1/api-keys", "implementation": "hono", "transport": "http", "version": "v1", "test": "tests/auth-api.test.ts" },
    { "method": "POST", "path": "/api/v1/api-keys", "implementation": "hono", "transport": "http", "version": "v1", "test": "tests/auth-api.test.ts" },
    { "method": "DELETE", "path": "/api/v1/api-keys/:id", "implementation": "hono", "transport": "http", "version": "v1", "test": "tests/auth-api.test.ts" },
    { "method": "GET", "path": "/api/v1/community/health", "implementation": "hono", "transport": "http", "version": "v1", "test": "tests/community-api.test.ts" },
    { "method": "GET", "path": "/api/v1/community/me", "implementation": "hono", "transport": "http", "version": "v1", "test": "tests/community-api.test.ts" },
    { "method": "GET", "path": "/api/v1/community/sign-in", "implementation": "hono", "transport": "http", "version": "v1", "test": "tests/community-api.test.ts" },
    { "method": "POST", "path": "/api/v1/community/sign-out", "implementation": "hono", "transport": "http", "version": "v1", "test": "tests/community-api.test.ts" },
    { "method": "GET", "path": "/api/v1/community/dev-login", "implementation": "hono", "transport": "http", "version": "v1", "test": "tests/community-api.test.ts" },
    { "method": "GET", "path": "/api/v1/community/feed", "implementation": "hono", "transport": "http", "version": "v1", "test": "tests/community-api.test.ts" },
    { "method": "GET", "path": "/api/v1/community/posts/:id", "implementation": "hono", "transport": "http", "version": "v1", "test": "tests/community-api.test.ts" },
    { "method": "GET", "path": "/api/v1/community/users/:login", "implementation": "hono", "transport": "http", "version": "v1", "test": "tests/community-api.test.ts" },
    { "method": "POST", "path": "/api/v1/community/posts", "implementation": "hono", "transport": "http", "version": "v1", "test": "tests/community-api.test.ts" },
    { "method": "DELETE", "path": "/api/v1/community/posts/:id", "implementation": "hono", "transport": "http", "version": "v1", "test": "tests/community-api.test.ts" },
    { "method": "POST", "path": "/api/v1/community/posts/:id/like", "implementation": "hono", "transport": "http", "version": "v1", "test": "tests/community-api.test.ts" },
    { "method": "DELETE", "path": "/api/v1/community/posts/:id/like", "implementation": "hono", "transport": "http", "version": "v1", "test": "tests/community-api.test.ts" },
    { "method": "POST", "path": "/api/v1/community/moderation/terms", "implementation": "hono", "transport": "http", "version": "v1", "test": "tests/community-moderation.test.ts" },
    { "method": "GET", "path": "/api/v1/community/stats", "implementation": "hono", "transport": "http", "version": "v1", "test": "tests/community-api.test.ts" },
    { "method": "GET", "path": "/api/v2/plugins", "implementation": "hono", "transport": "http", "version": "v2", "schema": "schemas/v2/plugins.response.schema.json", "test": "tests/api-contract.test.ts" },
    { "method": "GET", "path": "/api/v2/plugins/:owner/*", "implementation": "hono", "transport": "http", "version": "v2", "test": "tests/app.test.ts" },
    { "method": "GET", "path": "/api/v2/rankings", "implementation": "hono", "transport": "http", "version": "v2", "schema": "schemas/v2/rankings.response.schema.json", "test": "tests/api-contract.test.ts" },
    { "method": "GET", "path": "/api/v3/rankings", "implementation": "hono", "transport": "http", "version": "v3", "schema": "schemas/v3/rankings.response.schema.json", "test": "tests/api-contract.test.ts" }
  ],
  "aliases": [
    { "host": "api.deepseek1024.com", "path": "/v1/health", "target": "/api/v1/health", "test": "tests/public-api.test.ts" },
    { "host": "api.deepseek1024.com", "path": "/v1/plugins/search", "target": "/api/v1/plugins/search", "test": "tests/public-api.test.ts" }
  ]
}
